{
  "schemaVersion": 1,
  "providerId": "library",
  "requestId": "fixture-library-summary",
  "operation": "summary",
  "context": {
    "scope": "device",
    "deviceId": "fixture-device-1",
    "consentRevision": "consent-1"
  },
  "privacy": "private",
  "coverage": "device-local",
  "status": "ready",
  "observedAt": "2026-10-01T08:00:00.000Z",
  "expiresAt": "2026-10-01T08:02:00.000Z",
  "sourceUpdatedAt": "2026-10-01T08:00:00.000Z",
  "data": {
    "items": [
      {
        "resourceId": "example-work",
        "title": "Example book",
        "format": "epub",
        "edition": 1,
        "releaseVersion": "v1",
        "current": 0.3,
        "furthest": 0.6,
        "updatedAt": "2026-10-01T08:00:00.000Z"
      }
    ]
  }
}
