{
  "schemaVersion": 1,
  "providerId": "notes",
  "requestId": "fixture-notes-summary",
  "operation": "summary",
  "context": {
    "scope": "account",
    "accountId": "11111111-1111-4111-8111-111111111111",
    "workspaceId": null,
    "grantRevision": "notes-grant-1",
    "translationId": null
  },
  "privacy": "private",
  "coverage": "cloud-snapshot",
  "status": "ready",
  "observedAt": "2026-10-01T08:00:00.000Z",
  "expiresAt": "2026-10-01T08:02:00.000Z",
  "sourceUpdatedAt": "2026-10-01T08:00:00.000Z",
  "data": {
    "items": [
      {
        "resourceId": "33333333-3333-4333-8333-333333333333",
        "title": "Example note",
        "updatedAt": "2026-10-01T08:00:00.000Z"
      }
    ]
  }
}
